"ID","text","Requirement","target","nature","interpretability","[Motivation for ambiguity]","reference","Logic rule","Comments"
"K63399","Varningsskylten ska placeras i 45º korsningsvinkel mot vägen.","The warning sign should be placed at a 45º intersection angle to the road.","Product","Quantitative","Ambiguous (artificial)","It's unclear which axis the angle refers to. Maybe this is tacit knowledge in the domain.","No reference",,
"K64336","Spänningsförande friledningar för tågdrift (matarledning, hjälpkraftledning och återledning) får inte permanent förläggas över plattformar där människor vistas.","Live overhead lines for train operation (feeder line, auxiliary power line and return line) must not be permanently installed over platforms where people are present.","Product","Qualitative","Non-ambiguous",,"No reference",,
"K47635","Indikeringslampa respektive tryckknapp ska vara märkta med en skylt ovanför respektive lampa/tryckknapp.","The indicator light and push button must be marked with a sign above the respective light/push button.","Product","Qualitative","Ambiguous (artificial)","What sign? Any sign?","No reference",,
"K46405","Gånggrind i områdesskydd ska vara utrustad med godkänd låsenhet, i enlighet med SSF200.","Pedestrian gates in area protection must be equipped with an approved locking device, in accordance with SSF200.","Product","Qualitative","Non-ambiguous",,"External",,
"K81775","Stängsel ska uppfylla kraven enligt SSF 1087, Klass C, Risknivå 2.","Fences must meet the requirements of SSF 1087, Class C, Risk Level 2.","Product","Qualitative","Non-ambiguous",,"External",,
"K53671","För isolerad sektionsövergång över tre övergångsspann ska skyltar vara placerade enligt figur 4.","For insulated section transitions over three transition spans, signs shall be placed according to Figure 4.","Product","Mixed","Non-ambiguous",,"Local",,
"K52959","Kabeln ska kunna identifieras genom dess beteckning.","The cable should be identifiable by its designation.","Product","Qualitative","Ambiguous (artificial)","What should be indentified? Type of the cable, location, brand, what?","No reference",,
"K38784","Apparatskåp vid trafikkontrollplats ska vara enligt {TRVINFRA-00250 Apparatskåp vägoperativ miljö}.","Equipment cabinets at traffic control points must be in accordance with {TRVINFRA-00250 Equipment cabinets, road operating environment}.","Product","Qualitative","Non-ambiguous",,"Internal",,
"K53673","I växelkryss med isolerade ryttare ska skylt vara placerad enligt figur 5 så att minsta isolationsavstånd inte underskrids.","At interchanges with isolated riders, the sign must be placed according to Figure 5 so that the minimum isolation distance is not exceeded.","Product","Qualitative","Ambiguous (artificial)","Minimum isolation distance is an unspecified quantity artificially ambiguous.","Local",,
"K29453","Överklättringsskydd av typen hajtand ska finnas på grind om anslutande stängsel saknar taggtråd.","""Shark tooth"" type anti-climb protection must be installed on the gate if the connecting fence does not have barbed wire.","Product","Qualitative","Non-ambiguous",,"No reference",,
"K46663","WC-stol ska vara av porslin.","The toilet seat must be made of porcelain.","Product","Qualitative","Non-ambiguous",,"No reference",,
"K161329","Detektorer för växeltungans läge ska vara utförda enligt utläggningsritning för respektive spårväxlar.","Detectors for the position of the switch tongue must be designed according to the layout drawing for the respective switches.","Product","Qualitative","Non-ambiguous",,"Internal",,
"K34308","Plattformsskyltar på plattformar ska  om det är tekniskt möjligt  placeras på en höjd av 2 700 mm mätt från skyltens underkant.","Platform signs on platforms shall  if technically possible  be placed at a height of 2,700 mm measured from the bottom edge of the sign.","Product","Quantitative","Non-ambiguous",,"No reference",,
"K31364","Tilläggsskylt låssymbol ska ha dimension 200x200 mm.","Additional lock symbol sign should have dimensions of 200x200 mm.","Product","Quantitative","Non-ambiguous",,"No reference",,
"K9670","Trafikinformationstavlor av typ A ska vara monterade på en fri höjd av 5,5 m (tolerans - 0,1 till +0,2m) inklusive bärande konstruktioner.","Type A traffic information signs must be mounted at a clear height of 5.5 m (tolerance - 0.1 to +0.2 m) including supporting structures.","Product","Quantitative","Non-ambiguous",,"No reference",,
"K58677","Styrkabel mellan master- och slavskåp ska vara skärmad och partvinnad.","The control cable between the master and slave cabinets must be shielded and twisted pair.","Product","Qualitative","Non-ambiguous",,"No reference",,
"K160248","Uppehållstavla ska visa antingen bokstaven U, eller siffror som anger tåglängden i meter.","The stop sign should display either the letter ""U"", or numbers indicating the train length in meters.","Product","Qualitative","Non-ambiguous",,"No reference",,
"K134489","Träpåle ska förläggas på en nivå ? 200 mm under LLW50 eller lägsta grundvattenyta.","Wooden piles should be placed at a level ? 200 mm below LLW50 or lowest groundwater level.","Product","Quantitative","Non-ambiguous",,"No reference",,
"K134997","Lådbalks invändiga utrymme ska vara dränerat med dräneringshål med diameter ? 50 mm genom underfläns.","The interior space of the box girder must be drained with drainage holes with a diameter ? 50 mm through the bottom flange.","Product","Quantitative","Non-ambiguous",,"No reference",,
"K34739","Hårdlödning ska användas vid igensättning av hål i växeltungor.","Brazing should be used when plugging holes in switch tongues.","Process","Qualitative","Non-ambiguous",,"No reference",,
"K37397","Vid dubbelsidig användning ska den sida märkas som har minst sidoslitage.","When using double-sided, the side with the least side wear should be marked.","Process","Qualitative","Ambiguous (artificial)","Marked how? How is wear measured?","No reference",,
"K118449","En person som uppfyller alla krav enligt kapitel Förutsättningar för ibruktagandebesiktningsman banöverbyggnad ska vara behörig endast om hen genomgår en kurs med godkänt resultat.","A person who meets all the requirements according to the chapter ""Requirements for commissioning inspectors for track superstructure"" shall only be qualified if he or she completes a course with a passing score.","Process","Qualitative","Non-ambiguous",,"Local",,
"K47105","Skyddsutjämningsledare ska följa kanalisation och vara ansluten till varje del av kanalisation.","Protective equalization conductors must follow the ductwork and be connected to each part of the ductwork.","Product","Qualitative","Ambiguous (artificial)","Not clear what ""each part"" here exactly means. Potential for misunderstanding.","No reference",,
"K210132","Märkbrickor i Trafikverkets kopparkabelanläggningar ska placeras på eller i direkt anslutning till samtliga utomhusplacerade Telecom-boxar.","Labels in the Swedish Transport Administration's copper cable installations must be placed on or in direct connection to all outdoor Telecom boxes.","Product","Qualitative","Non-ambiguous",,"No reference",,
"K34244","Väggmonterade statiska skyltar i stationshus ska  om det är tekniskt möjligt  placeras på en höjd av 1 600 mm mätt från skyltens underkant.","Wall-mounted static signs in station buildings should  if technically possible  be placed at a height of 1,600 mm measured from the bottom edge of the sign.","Product","Quantitative","Non-ambiguous",,"No reference",,
"K46258","Dräneringsrör ska ha slät insida.","Drainage pipes should have a smooth inside.","Product","Qualitative","Ambiguous (artificial)","Smoothness is not defined, but could.","No reference",,
"K62626","Kontaktledningslutningen mellan två upphängningspunkter får inte överstiga 2 .","The contact line slope between two suspension points must not exceed 2.","Product","Quantitative","Non-ambiguous",,"No reference",,
"K30931","Mätpunkter på varje 20 meters-intervall ska väljas utifrån kontroll enligt avsnitt 9.","Measurement points at each 20 meter interval shall be selected based on control according to section 9.","Process","Quantitative","Non-ambiguous",,"Local",,
"K6873","Huvudelkopplare i apparatskåp ska vara låsbar med säker avskiljning av samtliga grupper.","The main switch in the electrical cabinet must be lockable with safe separation of all groups.","Product","Qualitative","Ambiguous (artificial)","The intention here is not clear, hence what ""lockable"" and ""safe"" means is up to interpretation.","No reference",,
"K1891","Trafikinformationstavlor av typ B ska vara monterade på stolpar och bärverk av fackverkstyp.","Type B traffic information signs must be mounted on posts and truss-type supports.","Product","Qualitative","Non-ambiguous",,"No reference",,
"K195234","Körfältsvägvisare i portal ska vara monterade med horisontell underkant.","Lane direction indicators in portals should be mounted with a horizontal bottom edge.","Product","Qualitative","Non-ambiguous",,"No reference",,
"K194950","Vertikal snölast ska appliceras på gångbryggor, serviceplan etc.","Vertical snow load should be applied to walkways, service levels, etc.","Process","Qualitative","Ambiguous (artificial)","I assume this is a process requirement for calculating the needed bearing capability of objects under snow pressure. It is ambiguous because its scope (to what it applies) ends with ""etc."" making the scope undefined.","No reference",,
"K135723","Långsam växel ska dimensioneras för statisk last.","Slow gear should be dimensioned for static load.","Product","Qualitative","Ambiguous (artificial)","Ambiguous for me, possible because lack of domain knowledge. ""Slow"" is ambiguous and unclear to what ""static load"" refers to.","No reference",,
"K3449","Beställarens granskningstider för dokument i dokumentleveranser ska vara 10 arbetsdagar.","The customer's review time for documents in document deliveries shall be 10 working days.","Process","Quantitative","Non-ambiguous",,"No reference",,
"K129238","Redogörelse för konstruktionsarbetets förutsättningar och metoder, ritning och beskrivning ska upprättas på svenska.","An account of the conditions and methods of the construction work, drawings and descriptions must be prepared in Swedish.","Documentation","Qualitative","Non-ambiguous",,"No reference",,
"K62191","Tillverkaren eller dess representant ska lämna en EG-försäkran om överensstämmelse med skyddskrav.","The manufacturer or his representative must provide an EC declaration of conformity with protection requirements.","Documentation","Qualitative","Non-ambiguous",,"No reference",,
"K126161","Böjningsradien för kablar tillhörande kabelfamilj JZ-500 HMH får inte understiga 6 x kabeldiametern.","The bending radius for cables belonging to the JZ-500 HMH cable family must not be less than 6 x the cable diameter.","Process","Quantitative","Non-ambiguous",,"No reference",,
"K34333","Hänvisningsskyltar på plattformar som monteras hängande under plattformstaket ska placeras på en höjd av 2 700 mm mätt från skyltens underkant.","Information signs on platforms that are mounted suspended below the platform roof must be placed at a height of 2,700 mm measured from the bottom edge of the sign.","Product","Quantitative","Non-ambiguous",,"No reference",,
"K134597","Stålöverbyggnad med brobaneplatta av betong ska utformas med samverkan mellan huvudbalkar och brobaneplatta.","Steel superstructure with concrete deck slab shall be designed with interaction between main beams and deck slab.","Product","Qualitative","Ambiguous (artificial)","Ambiguous because it is unclear what ""interaction"" means in this context.","No reference",,
"K29841","Stängsel får inte monteras så att stängsels spännkraft verkar på märla, se figur K7.","Fences must not be installed so that the tension of the fence acts on the soil, see figure K7.","Product","Qualitative","Non-ambiguous","Could also be process because the requirements refers to installing the fence.","Local",,
"K29166","Stängsel får inte placeras inom arbetsbredd hos angränsande räcke.","Fences must not be placed within the working width of adjacent railings.","Product","Qualitative","Ambiguous (artificial)","Working width of a rail is not clear to what it refers to.","No reference",,
"K63424","Skyddsportal i järnvägs tvärsektion ska sättas upp 8 - 12 m från närmaste räl.","Safety gates in railway cross sections should be set up 8 - 12 m from the nearest rail.","Product","Quantitative","Non-ambiguous",,"No reference",,
"K195587","Stag och strävor ska ha samma beständighet som angetts för stolparna.","Ties and struts must have the same durability as specified for the posts.","Product","Qualitative","Non-ambiguous",,"No reference",,
"K118413","Ibruktagandebesiktningsman ska dokumentera besiktning enligt TMALL 0377 Ibruktagandebesiktning bananläggning bilaga F, och även signera dokumentet.","The commissioning inspector must document the inspection according to TMALL 0377 Commissioning inspection of track facilities, appendix F, and also sign the document.","Documentation","Qualitative","Non-ambiguous",,"Internal",,
"K135893","Elstängsel ska följa kraven i SSF 1087 för respektive områdesskyddsklass.","Electric fencing must comply with the requirements of SSF 1087 for each area protection class.","Product","Qualitative","Non-ambiguous",,"External",,
"K44199","Stångarmering och ingjutningsgods av konstruktionsstål ska alltid täckas med ett täckande betongskikt.","Bar reinforcement and structural steel castings should always be covered with a covering layer of concrete.","Product","Qualitative","Non-ambiguous",,"No reference",,
"K2608","För sammansatt utrustning som apparatskåp, ventilationsaggregat och liknande ska märkskyltar vara monterade på eller i front.","For composite equipment such as control cabinets, ventilation units and the like, nameplates must be mounted on or in the front.","Product","Qualitative","Non-ambiguous",,"No reference",,
"K47630","Apparatskåp ska vara märkt enligt TRVINFRA-00070 Elkraftsanläggning Stationer.","The control cabinet must be marked according to TRVINFRA-00070 Electric Power Plant Stations.","Product","Qualitative","Non-ambiguous",,"Internal",,
"K82085","Kortläsare ska vara utrustat med vandalskydd.","Card readers must be equipped with vandal protection.","Product","Qualitative","Ambiguous (natural)","Since the type of protection is not specified, natural ambiguity.","No reference",,
"K56251","Snörasskydd ska finnas ovanför ytterdörrar och andra passager.","Snow guards should be installed above exterior doors and other passageways.","Product","Qualitative","Ambiguous (artificial)","""other"" makes the requirement ambiguous since scope is now open and open to interpretation where the guards need to be installed.","No reference",,
"K56027","Hyllan med tangentbord och pekdon ska kunna fällas in i kontrollskåpet.","The shelf with the keyboard and pointing device should be able to be folded into the control cabinet.","Product","Qualitative","Non-ambiguous",,"No reference",,
"K44062","Laster från ovanförliggande eller intilliggande byggnadsverk ska delas upp i permanenta laster och variabla laster.","Loads from overhead or adjacent structures shall be divided into permanent loads and variable loads.","Process","Qualitative","Non-ambiguous",,"No reference",,
"K56193","Konstruktionsvirke ska minst vara utfört i kvalitet C14 där ej annat anges.","Structural timber must be at least of quality C14 unless otherwise stated.","Product","Qualitative","Non-ambiguous",,"No reference",,
"K2896","Synbarhet hos vägbaneljus för avstängningsanordningar ska vara tydlig på 100 - 10 meters avstånd förutsatt att konstruktioner utanför vägbanan inte begränsar sikten.","Visibility of roadway lights for closing devices shall be clear at a distance of 100 - 10 meters provided that structures outside the roadway do not restrict visibility.","Product","Mixed","Ambiguous (artificial)","""Clear visibility"" is ambiguous.","No reference",,
"K49350","Tryckknappar för lokal manövrering ska vara märkt med skylt med texten FÖR PROVNING.","Pushbuttons for local operation must be marked with a sign with the text FOR TESTING.","Product","Qualitative","Non-ambiguous",,"No reference",,
"K6389","Markeringsskärmar på vägbom för tvåsidiga avstängningsanordningar ska vara med individuell markeringsskärm per bom.","Marking screens on road barriers for two-sided closure devices must have an individual marking screen per barrier.","Product","Mixed","Non-ambiguous",,"No reference",,
"K29436","Skjutgrind ska monteras fribärande i stativ enligt tillverkarens anvisning.","Sliding gates should be mounted cantilevered in a frame according to the manufacturer's instructions.","Product","Qualitative","Non-ambiguous",,"No reference",,
"K53186","Varningsskyltar ska sitta vid plankorsningar.","Warning signs must be placed at level crossings.","Product","Qualitative","Ambiguous (artificial)","The placement is not clear. It is not natural amguity since this is not about solution freedom but safety.","No reference",,
"K30518","Rälsförhöjning ska anordnas så att ytterräl ligger högre än innerräl.","Rail elevation should be arranged so that the outer rail is higher than the inner rail.","Product","Quantitative","Non-ambiguous",,"No reference",,
"K30144","Vid nybyggnation ska normalsektion för fria rummet enligt figur K5.","In new construction, the normal section for the free space should be according to Figure K5.","Product","Qualitative","Non-ambiguous",,"Local",,
"K195029","Betongen ska uppfylla kraven i SS-EN 206 och SS 137003, Betong  användning av EN 206 i Sverige.","The concrete must meet the requirements of SS-EN 206 and SS 137003, Concrete - use of EN 206 in Sweden.","Product","Qualitative","Non-ambiguous",,"External",,
"K6210","Kameraenheter av fast typ med fjärrmanövrerad zoom ska bildutsnittet vara med möjlighet att styras via ONVIF, Profil S.","Fixed-type camera units with remote-controlled zoom must have the ability to control the image section via ONVIF, Profile S.","Product","Qualitative","Non-ambiguous",,"No reference",,
"K195209","En skylt ska vara tillverkad av material som uppfyller krav enligt avsnitt 5.","A sign shall be made of material that meets the requirements of section 5.","Product","Qualitative","Non-ambiguous",,"Local",,
"K10168","Trafikinformationstavla av typ A1W, A2W, A3W ska vara med gångbrygga till entrédörr.","Traffic information boards of type A1W, A2W, A3W must have a walkway to the entrance door.","Product","Qualitative","Non-ambiguous",,"No reference",,
"K209322","I samband med nybyggnation av Trafikverkets optokabelanläggningar i tunnlar ska fibrerna i lokalkablar avsedda för tele- och datakommunikation anslutas med UPC- kontakter till blå mellanstycken i ODF-enheter.","In connection with the construction of new optical cable installations in tunnels by the Swedish Transport Administration, the fibers in local cables intended for telecommunications and data communication must be connected with UPC connectors to blue adapters in ODF units.","Product","Qualitative","Non-ambiguous",,"No reference",,
"K73689","Bullerskyddsskärm ska kunna motstå påverkan från vegetationsröjning av intilliggande yta utan att skadas.","Noise protection screens must be able to withstand the impact of vegetation clearing of adjacent areas without being damaged.","Product","Qualitative","Ambiguous (natural)","From a verification perspective, this capability is difficult to test.","No reference",,
"K29725","Spärrstängsel ska dras fram till säkerhetszon.","Barriers should be erected to the safety zone.","Product","Qualitative","Ambiguous (artificial)","Not clear from where the barriers should be erected.","No reference",,
"K6324","I anslutningar till portaler eller master försedda med åskskydd och överspänningsskydd ska skylt med text ""ANLÄGGNINGEN ÄR FÖRSEDD MED ÅSKSKYDD OCH ÖVERSPÄNNINGSSKYDD"" vara redovisad.","In connections to portals or masts equipped with lightning protection and surge protection, a sign with the text ""THE SYSTEM IS EQUIPPED WITH LIGHTNING PROTECTION AND SURGE PROTECTION"" must be displayed.","Product","Qualitative","Non-ambiguous",,"No reference",,
"K29162","Stängsel ska utformas och placeras så att det inte skymmer fri sikt vid plankorsning.","Fences should be designed and placed so that they do not obstruct clear visibility at level crossings.","Product","Qualitative","Ambiguous (artificial)","Clear visibility is ambiguoys. Visibility for who?","No reference",,
"K55617","Märkning ska vara utförd med skyltämne enligt ritning 3-800132 - Skyltämne för stolpbeteckning.","Marking shall be carried out with sign blanks according to drawing 3-800132 - Sign blanks for pole designation.","Product","Qualitative","Non-ambiguous",,"Internal",,
"K125516","Orienteringstavla, se figur nedan, ska med tilläggsskylt med driftplatssignatur, finnas före en infartssignal på försignalavstånd till infartssignalen.","An orientation board, see figure below, with an additional sign with the operating location signature, must be located before an approach signal at a pre-signal distance to the approach signal.","Product","Qualitative","Ambiguous (artificial)","Unclear to what the pre-signal distance refers to. Also, horribly convoluted.","Local",,
"K72165","Tillåten vindavdrift ska väljas utifrån vilken eller vilka bredder av strömavtagare som anläggningen ska dimensioneras för.","Permitted wind drift should be selected based on which pantograph width(s) the system is to be dimensioned for.","Product","Qualitative","Non-ambiguous",,"No reference",,
"K8739","Panelkort ska vara enligt {SS 455 12 01 T1 Dokumentation av teletekniska anläggningar}.","Panel cards must be in accordance with {SS 455 12 01 T1 Documentation of telecommunications installations}.","Product","Qualitative","Non-ambiguous",,"External",,
"K31361","Utrymningsskylt ISO 7010-E001 och ISO 7010-E002 ska ha dimension 200x200 mm.","Evacuation signs ISO 7010-E001 and ISO 7010-E002 must have dimensions of 200x200 mm.","Product","Quantitative","Non-ambiguous",,"External",,
"K37392","Räler som ska sändas till Rälsverkstaden i Sannahed för revidering med rälsverkstadens utrustning får inte överstiga 60 m.","Rails to be sent to the Rail Workshop in Sannahed for revision with the rail workshop's equipment must not exceed 60 m.","Process","Quantitative","Non-ambiguous",,"No reference",,
"K9539","Beställarens provningsansvarige ska utfärda intyg om genomfört provningssteg efter avslutad provning som Beställaren ansvarar för.","The Client's testing manager shall issue a certificate of completion of the testing step after completion of the testing for which the Client is responsible.","Documentation","Qualitative","Non-ambiguous",,"No reference",,
"K161368","Kontrollåsnyckeln ska utgöra en kvittens på att det tillhörande objektet intar rätt läge och att förändring av läget är förhindrad så länge kontrollåsnyckeln inte används.","The control lock key shall constitute a confirmation that the associated object is in the correct position and that changes to the position are prevented as long as the control lock key is not used.","Product","Qualitative","Non-ambiguous",,"No reference",,
"K126087","I de fall det finns en Z-förbindning på platsen för anslutningen av upptag och eventuell matning ska anslutningen av de senare vara flyttade en sliper bort från isolerskarven.","In cases where there is a Z-connection at the location of the connection of the intake and any supply, the connection of the latter must be moved one sleeper away from the insulation joint.","Product","Mixed","Non-ambiguous",,"No reference",,
"K72733","Omriktare ska ha beteckningen OMR och ett löpnummer och utförandet enligt Figur 12.","Inverters shall have the designation OMR and a serial number and the design according to Figure 12.","Product","Qualitative","Non-ambiguous",,"Local",,
"K35200","Med växeltungor i öppet läge, ska stödrälen slipas över hela den definierade målprofilen.","With the switch tongues in the open position, the support rail should be ground over the entire defined target profile.","Product","Qualitative","Non-ambiguous","Not so clear what this means, could also be ambiguous due to that.","No reference",,
"K34379","Lyftbord ,i kontrollgrop vid trafikkontrollplats, ska vara levererad med tre (3) st.","Lift tables, in the inspection pit at the traffic control point, shall be supplied with three (3) pieces.","Product","Quantitative","Ambiguous (artificial)","Not clear what 3 refers to. What needs to be delivered 3 times?","No reference",,
"K7313","Vid kopplingsställe ska jordtagsledare vara försedd med märkskylt.","At the connection point, the earthing conductor must be provided with a nameplate.","Product","Qualitative","Non-ambiguous",,"No reference",,
"K13262","Apparatskåp i fuktig miljö ska vara konstruerade så att kondens i apparatskåp motverkas.","Equipment cabinets in humid environments must be designed to prevent condensation in equipment cabinets.","Product","Qualitative","Ambiguous (natural)","Solution for how to present condensation is open.","No reference",,
"K30169","Inom ej streckade delar av normalsektion för fria rummet får inte förekomma annat än lastkaj, spärrstaket, rangerbroms och portöppning, se särskilda regler i kapitel 6.","Within non-hatched parts of the normal section for free space, there may be nothing other than loading docks, barrier fences, shunting brakes and gate openings, see special rules in Chapter 6.","Product","Qualitative","Non-ambiguous",,"Local",,
